text,sumber
"stress level gw udah tinggi, mau healing tp ga ada waktu sama sekali 😰",twitter
"ngrasa disconnect sama diri sendiri,, kayak liat hidup dr luar",twitter
"gabisa tidur dr beberapa hari ini, badan cape banget tp otak ga mau berhenti",twitter
"anxiety gw kumat lg, jantung deg2an pdhl ga ada apa2 help",twitter
"gw gabisa tidur dr dua hari lalu, pikiran muter2 ga brenti ttg pekerjaan 😞",twitter
"ga bs dapet, tidur yg berkualitas, trs kebangun tengah malem 😴",twitter
"otak gw overload poll, info kebanyakan, ga bs fokus :(",twitter
"setiap bangun pagi ngerasa berat bgt, gamau ngapa2in pengen, tiduran aja",twitter
badan udh minta istirahat tp pikiran malah makin aktif pas mau tidur 😭😭,twitter
"udh ga ngrasa apa2 lg, kosong amat dalem sini, sedih jg ga bs",twitter
https://t.co/abcxyz @collegemenfess check this out!!!,twitter
"tiap hari ada aja masalah baru, ga sempet napas udh dateng lg yg baru",twitter
"was2 banget nunggu hasil meeting, deg2an sampe ga napsu makan",twitter
"ga tau knp nangis2 sendiri, ngrsa ga berguna bgt hidup gw slesai",twitter
"mata udh berat parah, tp begitu rebahan langsung melek lg",twitter
"ngerasa hampa poll, udh lama ga bs seneng sama sekali capek hidup huhu",twitter
"udh minum susu, matiin hp, tp tetep aja melek sampe subuh",twitter
"ga ada semangat buat ngelakuin apapun, hari2 berat amat",twitter
"tertekan banget sm ekspektasi ortu, capek ngejar standar org lain mulu 😴",twitter
"males ngapa2in, bangun tidur aja cape, parah, pengen ilang aja 😰",twitter
"putus asa bgt, udh nyoba banyak hal tp ga ada yg berhasil pengen nyerah :(",twitter
"kelelahan amat tp ga, bs tidur, badan lemes otak masih jalan terus",twitter
follow @akunjualan dapat cashback,twitter
"ngerasa trapped di situasi, yg ga bs gw kontrol, stress poll",twitter
"pola tidur gw rusak parah, tidur jam 4 bangun jam 12 tiap hari 😞",twitter
"udh di titik jenuh parah, smua terasa berat ga ada yg ringan",twitter
"ngerasa ga kuat lg nanggung smua sendirian, terlalu banyak huhu",twitter
"ga tau knp nangis2 sendiri, ngrsa ga berguna, banget hidup gw slesai",twitter
"males ngapa2in, bangun tidur aja cape amat, pengen ilang aja",twitter
rt @user: retweet ini buat keberuntungan,twitter
"ga bisa fokus sm sekali, pikiran kemana2 overthinking parah parah sih huhu",twitter
mata udh berat amat tp begitu rebahan langsung melek lg,twitter
"ga bs dapet tidur yg berkualitas,, trs kebangun tengah malem 💔",twitter
"gabisa tidur dr tadi siang, badan cape bgt tp otak ga mau berhenti",twitter
"udh jam 3 pagi masih melek, besok ada presentasi tp mata ga mau tutup",twitter
"anxiety gw kumat lg, jantung deg2an pdhl ga ada apa2 help huhu",twitter
"nervous amat sebelum meeting, perut mual deg2an",twitter
capek pura2 baik2 aja pdhal dalem sini hancur bgt,twitter
"capek banget sm, tuntutan yg ga ada abisnya, gw jg manusia bkn robot",twitter
@collegemenfess kak boleh kirim curhatan ga?,twitter
"udh berminggu2 ga bisa ngrasa, seneng, ketawa jg rasanya hampa 😰",twitter
"ngrasa sendirian bgt pdhl dikelilingin banyak org, ngga ada yg ngerti gw 🤯",twitter
"jam segini masih melek pdhl besok pagi hrs, kuliah, capek amat",twitter
"tiap mau tidur kepikiran macem2, makanya ga bs tidur",twitter
"nervous poll mau ketemu org baru, sosial anxiety gw emg parah :(",twitter
"nangis di kamar mandi biar ga ketauan, sendirian amat 😭😭",twitter
"ga ada semangat buat ngelakuin apapun, hari2 berat amat 😭😭",twitter
follow @akunjualan dapat cashback,twitter
"udh coba segala cara buat tidur tp, mata ttp melek sampe pagi 😰",twitter
"panik banget tadi kerja, tangan gemetaran keringetan malu bngt",twitter
"udh ga ngrasa apa2, lg, kosong parah dalem sini, sedih jg ga bs :(",twitter
"takut gagal amat sampe, gemeteran sblm interview 😢",twitter
"khawatir kalo presentasi ga sesuai rencana, parno bgt jadinya 😢",twitter
"ngrasa hidup gw ga ada artinya, mau ngapain jg sia2 aja 😞",twitter
"pusing poll, semua hal dateng barengan, gamau mikir apa2 lg",twitter
"beban tugas kuliah numpuk, gw mau meledak rasanya",twitter
capek pura2 baik2 aja pdhal dalem sini hancur banget,twitter
"tekanan dr segala arah, dari ortu dosen pacar, mau kabur rasanya 😴",twitter
"insomnia gw makin parah belakangan ini, sampe sakit kepala tiap pagi :(",twitter
"khawatir kalo ujian ga sesuai rencana, parno bgt, jadinya",twitter
"ga ada semangat buat ngelakuin apapun, hari2, berat poll 😞",twitter
"pressure dr semua arah, ngerasa mau pecah tp hrs ttp strong 😰",twitter
"stress poll deadline numpuk smua minta beberapa hari ini,, otak gw uda ga jalan 🤯",twitter
"ngrasa hidup gw ga ada artinya,, mau ngapain jg sia2 aja 😢",twitter
"udh ga ngrasa apa2 lg, kosong bgt dalem sini, sedih jg ga bs, :(",twitter
"ngrasa hidup gw ga ada artinya, mau ngapain jg sia2, aja 😭😭",twitter
mata udh berat banget tp begitu rebahan langsung melek lg,twitter
"kebangun jam 3 trs ga bs tidur lg sampe pagi, stress jdnya huhu",twitter
"capek banget sm tuntutan yg ga ada abisnya,, gw jg manusia bkn robot",twitter
"ngerasa exhausted tp ttp ga bs tidur, ini paling nyiksa sih",twitter
"ga bisa fokus sm sekali, pikiran kemana2 overthinking parah parah sih 🤯",twitter
"udh 3 hari ini tidur kurang dr 3 jam, badan ga kuat huhu",twitter
"nangis di kamar mandi biar, ga ketauan, sendirian amat 😴",twitter
"ngrasa disconnect sama diri sendiri, kayak liat hidup dr, luar",twitter
"gw gabisa tidur dr, kmrn, pikiran muter2 ga brenti ttg masa depan",twitter
"panik parah tadi ujian, tangan gemetaran keringetan malu bngt",twitter
"pressure dr semua arah, ngerasa mau pecah tp hrs ttp strong :(",twitter
"capek amat sm tuntutan yg ga ada abisnya, gw jg manusia bkn robot",twitter
"ngrasa hidup gw ga ada artinya, mau ngapain jg sia2 aja, 💔",twitter
"pola tidur gw rusak parah, tidur jam 4 bangun jam 12 tiap hari :(",twitter
"anxiety gw kumat lg, jantung deg2an pdhl ga ada apa2 help 😞",twitter
"ngrasa gagal trs, ga pernah cukup apapun, yg gw lakuin",twitter
mata udh berat bgt tp begitu rebahan langsung melek lg,twitter
"udh lama ga ngrasa bahagia beneran, semua kerasa palsu 😢",twitter
"gelisah trs dr kmrn, entah knp, tiba2 ngrasa takut ga jelas gt",twitter
"was2 amat nunggu hasil meeting, deg2an sampe ga napsu, makan 😭😭",twitter
"tiap mau tidur, kepikiran macem2, makanya ga bs tidur 😴",twitter
"ngerasa trapped di situasi yg ga bs gw kontrol, stress bgt huhu",twitter
"khawatir kalo presentasi, ga sesuai rencana, parno bgt jadinya",twitter
"insomnia gw makin parah belakangan, ini, sampe sakit kepala tiap pagi",twitter
"kerja keras trs tp ga ada apresiasi, cape bgt sm kondisi ini :(",twitter
"ga bs tenang, pikiran muter trs ttg hasil test,, anxiety parah",twitter
"gabisa tidur dr tdi malem, badan cape banget tp otak ga mau berhenti 😢",twitter
"ngrasa sendirian poll pdhl dikelilingin banyak org, ngga ada yg ngerti gw",twitter
"ngrasa jd beban buat semua org, mending gw, ga ada aja kali ya",twitter
"ga bs tenang, pikiran muter trs ttg ujian, anxiety parah 💔",twitter
"kebangun jam 3 trs ga bs tidur lg sampe pagi,, stress jdnya",twitter
"ngerasa ga kuat lg nanggung smua sendirian, terlalu, banyak 😞",twitter
"gabisa tidur dr beberapa hari ini, badan cape amat tp otak ga mau berhenti",twitter
"gabisa tidur dr kmrn, badan cape amat tp otak, ga mau berhenti 😰",twitter
"rebahan dr jam 11 tp baru ketiduran subuh, badan ancur banget 😢",twitter
