text,sumber
"stress poll deadline numpuk smua minta kmrn malem, otak gw uda ga jalan",twitter
"frustrasi parah sama kondisi ini, udh usaha, tp ga ada perubahan jg 😰",twitter
@collegemenfess kak boleh kirim curhatan ga?,twitter
"otak gw overload bgt, info kebanyakan, ga, bs fokus :(",twitter
"udh coba segala cara buat tidur tp mata ttp melek sampe pagi, 💔",twitter
https://t.co/abcxyz @collegemenfess check this out!!!,twitter
"takut gagal poll sampe gemeteran sblm, pertemuan penting 😞",twitter
"setiap bangun pagi ngerasa berat parah, gamau ngapa2in pengen tiduran aja 😰",twitter
"kelelahan poll tp ga, bs tidur, badan lemes otak masih jalan terus",twitter
"tiap malem begadang, bukan krn mau tp emg gabisa tidur",twitter
https://t.co/abcxyz @collegemenfess check this out!!!,twitter
"capek poll sm tuntutan yg ga ada abisnya, gw jg manusia bkn robot",twitter
mata udh berat banget tp begitu rebahan langsung melek lg :(,twitter
"takut gagal bgt sampe, gemeteran sblm pertemuan penting",twitter
"mata udh berat parah tp begitu rebahan langsung melek, lg 😢",twitter
"ga mau ketemu siapapun, gamau ngomong, mau sendiri aja nangis :(",twitter
"tiap mau tidur kepikiran macem2, makanya ga bs, tidur 💔",twitter
"gw gabisa tidur dr tadi siang, pikiran muter2 ga brenti ttg presentasi",twitter
"ngerasa hampa amat, udh lama ga bs seneng sama sekali capek hidup",twitter
"nangis di kamar mandi biar ga ketauan, sendirian parah",twitter
rt @user: retweet ini buat keberuntungan,twitter
"ngrasa gagal trs, ga pernah cukup apapun yg gw, lakuin",twitter
"gw gabisa tidur dr seminggu lalu, pikiran muter2 ga brenti ttg nilai",twitter
"aq bngung parah mo nangis krn sidang skripsi mulu ttg, masa depan 😢",twitter
"tiap hari ada aja masalah baru, ga sempet napas udh dateng lg yg baru 😴",twitter
"udh di titik jenuh amat, smua terasa berat ga ada yg ringan 😞",twitter
"tiap hari ada aja masalah baru, ga sempet napas udh dateng lg yg baru huhu",twitter
"nangis tiba2 tanpa sebab,, udh biasa sih buat gw skrg",twitter
"jam segini masih melek pdhl, besok pagi hrs interview, capek amat :(",twitter
"udh ga sanggup, lg ngejalanin ini semua, capek banget sm rutinitas :(",twitter
"ngerasa exhausted tp ttp ga bs tidur, ini paling nyiksa sih 😢",twitter
"udh minum susu, matiin hp, tp tetep aja melek sampe subuh huhu",twitter
"tertekan bgt sm ekspektasi ortu, capek ngejar standar org lain mulu",twitter
"ga ada semangat buat ngelakuin apapun, hari2 berat banget :(",twitter
"jam segini masih melek pdhl besok pagi hrs kerja, capek parah 💔",twitter
"khawatir banget sama interview ini, takut org tua kecewa",twitter
follow @akunjualan dapat cashback,twitter
"ga tau knp nangis2 sendiri, ngrsa ga berguna parah hidup gw slesai",twitter
"pressure dr semua arah, ngerasa mau, pecah tp hrs ttp strong",twitter
"kebangun jam 3 trs ga bs tidur lg sampe pagi, stress jdnya 😰",twitter
"kerja keras trs tp ga ada apresiasi, cape poll sm kondisi ini 😢",twitter
"ngrasa sendirian bgt, pdhl dikelilingin banyak org, ngga ada yg ngerti gw 🤯",twitter
"was2 amat nunggu hasil interview, deg2an sampe ga, napsu makan",twitter
"takut amat sama future gw, smua org keliatan sukses cuma gw doang yg stuck",twitter
"tiap mau tidur kepikiran masalah keluarga, anxiety naik trs :(",twitter
"kelelahan poll tp ga bs tidur, badan lemes otak masih jalan terus 😢",twitter
"tiap hari ada aja masalah baru,, ga sempet napas udh dateng lg yg baru 😭😭",twitter
"muak bgt sm sistem, udh kerja keras tp yg dapet reward org lain 😴",twitter
"pusing poll, semua hal dateng barengan, gamau mikir apa2 lg 😭😭",twitter
"khawatir amat sama deadline kerjaan, ini, takut org tua kecewa",twitter
"capek pura2 baik2 aja pdhal dalem sini, hancur amat",twitter
"insomnia gw makin parah belakangan ini, sampe sakit kepala tiap pagi",twitter
"ga bs tenang, pikiran muter, trs ttg masa depan, anxiety parah",twitter
"mata udh berat parah tp begitu rebahan, langsung melek lg 😭😭",twitter
"rebahan dr jam, 11 tp baru ketiduran subuh, badan ancur bgt",twitter
"beban masa depan numpuk, gw mau meledak rasanya",twitter
"udh ga ngrasa apa2 lg, kosong parah dalem sini, sedih jg ga bs",twitter
"udh ga sanggup lg ngejalanin ini semua, capek, amat sm rutinitas 😰",twitter
"pola tidur gw rusak parah, tidur jam 4 bangun jam 12 tiap hari huhu",twitter
"ngrasa invisible aja pdhl lg di keramaian, ga ada yg liat gw",twitter
"nangis di kamar mandi biar ga ketauan, sendirian parah 😰",twitter
"kerja keras trs tp ga ada apresiasi, cape banget sm kondisi ini huhu",twitter
"panic attack lagi, napas sesak jantung mau copot tolong",twitter
"gabisa tidur dr kmrn, badan cape poll tp otak ga mau berhenti huhu",twitter
"nangis di kamar mandi biar ga ketauan, sendirian, parah",twitter
"kebangun jam 3 trs ga bs tidur lg sampe pagi, stress jdnya, 😞",twitter
"tiap mau tidur kepikiran masa depan, anxiety naik trs",twitter
"tiap malem begadang, bukan krn mau tp emg gabisa tidur 😴",twitter
"ga bisa fokus sm sekali, pikiran kemana2 overthinking parah parah sih",twitter
"putus asa poll, udh nyoba banyak hal tp ga ada yg berhasil pengen nyerah 😰",twitter
"gabisa tidur dr tdi malem, badan cape banget tp otak, ga mau berhenti",twitter
"deadline seminggu lalu tp belom mulai, stress gw tingkat dewa udh 😴",twitter
"nervous parah sebelum kerja,, perut mual deg2an",twitter
udh coba segala cara buat tidur tp mata ttp melek sampe pagi 😞,twitter
"udh ga ngrasa apa2 lg, kosong poll dalem sini, sedih jg ga bs",twitter
"deadline dua hari lalu tp belom mulai, stress gw tingkat dewa, udh 💔",twitter
"ga bs tenang, pikiran muter trs ttg tugas kuliah, anxiety parah 🤯",twitter
"ga tau knp nangis2 sendiri, ngrsa ga berguna amat hidup gw slesai",twitter
"udh jam 3 pagi masih melek, besok ada interview tp mata ga mau tutup 😞",twitter
"ga mau ketemu siapapun, gamau, ngomong, mau sendiri aja nangis 🤯",twitter
"takut banget sama future gw, smua org keliatan sukses cuma gw doang yg stuck",twitter
"burnout parah, udh sebulan kerja keras tp hasilnya nihil kecewa parah",twitter
"udh 3 hari ini tidur kurang dr 3 jam, badan ga, kuat",twitter
"pola tidur gw rusak parah, tidur jam 4 bangun jam 12 tiap hari 😭😭",twitter
"kebangun jam 3 trs ga bs, tidur lg sampe pagi, stress jdnya",twitter
"udh 3 hari ini tidur, kurang dr 3 jam, badan ga kuat huhu",twitter
"frustrasi amat sama kondisi ini, udh usaha tp ga ada perubahan jg 😰",twitter
"jam segini masih melek, pdhl besok pagi hrs kerja, capek banget 😞",twitter
"ga bisa fokus sm sekali, pikiran kemana2 overthinking parah bgt sih 🤯",twitter
"jam segini masih melek pdhl besok pagi hrs meeting, capek bgt",twitter
capek pura2 baik2 aja pdhal dalem sini hancur amat,twitter
"putus asa parah, udh nyoba banyak hal tp ga ada yg berhasil pengen nyerah",twitter
"beban nilai numpuk, gw mau meledak rasanya",twitter
"gabisa tidur dr dua hari lalu, badan cape poll tp, otak ga mau berhenti",twitter
"males ngapa2in, bangun tidur aja cape parah, pengen ilang aja 😞",twitter
"ga mau ketemu siapapun, gamau ngomong,, mau sendiri aja nangis",twitter
"udh ga ngrasa apa2 lg,, kosong amat dalem sini, sedih jg ga bs",twitter
udh coba segala cara buat tidur tp mata ttp melek sampe pagi 😴,twitter
"ga mau ketemu siapapun, gamau ngomong, mau sendiri, aja nangis",twitter
"ga bisa fokus sm sekali, pikiran kemana2 overthinking parah banget sih",twitter
"pusing banget, semua hal dateng barengan, gamau mikir apa2 lg 💔",twitter
"ngrasa invisible aja pdhl, lg di keramaian, ga ada yg liat gw huhu",twitter
"was2 banget nunggu hasil ujian, deg2an sampe ga napsu makan, 😰",twitter
@collegemenfess kak boleh kirim curhatan ga?,twitter
"nangis tiba2 tanpa sebab, udh biasa sih buat gw skrg 😭😭",twitter
"panik poll tadi pertemuan penting, tangan gemetaran keringetan malu bngt",twitter
"udh ga ngrasa apa2 lg, kosong banget dalem sini, sedih jg, ga bs",twitter
mata udh berat poll tp begitu rebahan langsung melek lg 🤯,twitter
"nervous poll sebelum meeting, perut mual deg2an 😴",twitter
"ngrasa disconnect sama diri sendiri, kayak liat hidup dr luar, 😴",twitter
"udh minum susu, matiin hp, tp tetep aja melek sampe subuh 🤯",twitter
"nervous poll mau ketemu org baru, sosial anxiety gw emg parah 😰",twitter
"beban deadline kerjaan numpuk, gw mau meledak rasanya 😢",twitter
"putus asa parah, udh nyoba, banyak hal tp ga ada yg berhasil pengen nyerah :(",twitter
"frustrasi parah sama kondisi ini, udh usaha tp ga ada perubahan jg",twitter
"tiap hari ada aja masalah baru, ga sempet napas udh dateng lg, yg baru",twitter
"rebahan dr jam 11 tp baru ketiduran subuh, badan ancur bgt 😢",twitter
"males ngapa2in, bangun tidur aja cape banget, pengen ilang aja 😢",twitter
"putus asa amat, udh nyoba banyak hal tp ga ada yg berhasil pengen nyerah 😭😭",twitter
"tertekan amat sm ekspektasi ortu, capek ngejar, standar org lain mulu",twitter
"udh lama ga ngrasa, bahagia beneran, semua kerasa palsu",twitter
"deadline tadi siang tp belom mulai, stress gw tingkat dewa udh :(",twitter
"kebangun jam 3 trs ga bs tidur lg sampe pagi, stress jdnya",twitter
"frustrasi banget sama kondisi ini, udh usaha tp ga ada perubahan jg 😭😭",twitter
"rebahan dr jam 11 tp baru ketiduran subuh, badan ancur parah huhu",twitter
"udh di titik jenuh banget, smua terasa berat ga ada yg ringan",twitter
"udh jam 3 pagi masih melek, besok ada ujian tp mata ga mau tutup 😴",twitter
"ga bs dapet, tidur yg berkualitas, trs kebangun tengah malem 🤯",twitter
"frustrasi amat sama kondisi ini, udh usaha tp, ga ada perubahan jg",twitter
"ngerasa ga kuat, lg nanggung smua sendirian, terlalu banyak 😢",twitter
"udh coba segala cara buat, tidur tp mata ttp melek sampe pagi 🤯",twitter
"tertekan poll sm ekspektasi ortu, capek ngejar standar org lain mulu",twitter
"udh lama ga ngrasa bahagia beneran, semua kerasa palsu 😴",twitter
"ga bs tenang, pikiran muter trs ttg hasil test, anxiety parah 😢",twitter
"nervous poll sebelum sidang, perut mual deg2an",twitter
"nangis di kamar mandi biar ga ketauan, sendirian parah :(",twitter
"ngrasa invisible aja pdhl, lg di keramaian, ga ada yg liat gw",twitter
"otak gw overload bgt, info kebanyakan, ga bs fokus",twitter
"ngerasa hampa banget, udh lama ga bs seneng sama sekali capek hidup 😰",twitter
"takut bgt sama future gw, smua org keliatan sukses cuma gw doang yg stuck 🤯",twitter
"deg2an trs dr tadi, ga tau knp kayak ada firasat ga enak gt",twitter
"was2 bgt nunggu hasil interview, deg2an sampe ga napsu makan 😴",twitter
"panik parah tadi sidang, tangan gemetaran keringetan malu bngt 😢",twitter
"udh lama ga ngrasa bahagia beneran, semua kerasa palsu 🤯",twitter
"tiap mau tidur kepikiran masa depan, anxiety naik trs 🤯",twitter
takut gagal poll sampe gemeteran sblm presentasi 😴,twitter
"jam segini masih melek pdhl besok pagi hrs kuliah, capek bgt :(",twitter
"deg2an trs dr, tadi, ga tau knp kayak ada firasat ga enak gt",twitter
"khawatir amat sama masa depan ini, takut org tua kecewa",twitter
"udh 3 hari ini tidur kurang, dr 3 jam, badan ga kuat 😴",twitter
"capek parah sm tuntutan yg ga ada abisnya, gw, jg manusia bkn robot",twitter
"insomnia kumat lg, tiap malem cuma rebahan sambil nangis huhu",twitter
"stress level gw udah, tinggi, mau healing tp ga ada waktu sama sekali",twitter
"ngerasa trapped di situasi yg, ga bs gw kontrol, stress amat",twitter
"ga ada semangat buat ngelakuin apapun, hari2, berat parah :(",twitter
"khawatir poll sama hubungan ini, takut org tua kecewa 😞",twitter
@collegemenfess kak boleh kirim curhatan ga?,twitter
"nervous poll mau ketemu org baru,, sosial anxiety gw emg parah",twitter
"stress poll deadline numpuk smua minta tdi malem, otak gw uda ga jalan",twitter
"panic attack lagi, napas sesak, jantung mau copot tolong",twitter
"pusing poll, semua hal dateng barengan, gamau mikir apa2 lg huhu",twitter
promo!! diskon 50% buruan order skrg,twitter
"stress poll deadline numpuk smua minta beberapa hari ini, otak gw uda ga jalan",twitter
"burnout parah, udh sebulan kerja keras tp hasilnya nihil kecewa amat 😰",twitter
"insomnia kumat lg, tiap malem cuma rebahan sambil nangis 😢",twitter
"nervous parah sebelum kerja, perut, mual deg2an :(",twitter
"beban hubungan numpuk, gw mau meledak rasanya",twitter
capek pura2 baik2 aja pdhal dalem sini hancur amat :(,twitter
"jam segini masih melek pdhl besok pagi hrs meeting, capek banget, huhu",twitter
"putus asa parah, udh nyoba banyak hal, tp ga ada yg berhasil pengen nyerah",twitter
"pressure dr semua arah, ngerasa mau pecah, tp hrs ttp strong",twitter
"tiap mau tidur kepikiran sidang skripsi, anxiety naik trs 😞",twitter
"udh lama ga, ngrasa bahagia beneran, semua kerasa palsu",twitter
"ga bs tenang, pikiran muter trs ttg deadline kerjaan, anxiety parah 💔",twitter
https://t.co/abcxyz @collegemenfess check this out!!!,twitter
"otak gw overload bgt, info kebanyakan, ga, bs fokus 😢",twitter
"udh ga ngrasa apa2 lg, kosong parah, dalem sini, sedih jg ga bs 😰",twitter
"ga ada semangat buat ngelakuin apapun, hari2 berat poll",twitter
"udh jam 3 pagi masih melek, besok ada meeting tp mata ga mau tutup",twitter
"overthinking trs smpe ga bs tidur, besok ada deadline kerjaan tp malah kepikiran yg bukan2",twitter
"burnout parah, udh sebulan kerja keras tp hasilnya nihil kecewa banget 😭😭",twitter
"ngerasa hampa poll, udh lama, ga bs seneng sama sekali capek hidup",twitter
"udh lama ga, ngrasa bahagia beneran, semua kerasa palsu 😢",twitter
"pusing parah, semua hal, dateng barengan, gamau mikir apa2 lg",twitter
"stress poll deadline, numpuk smua minta tadi siang, otak gw uda ga jalan",twitter
"overthinking trs smpe ga bs tidur, besok ada presentasi tp malah kepikiran yg bukan2 😢",twitter
"nervous poll mau ketemu org baru, sosial anxiety gw emg parah",twitter
"kerja keras trs tp ga ada apresiasi, cape banget sm kondisi ini",twitter
"ngrasa jd beban buat semua org, mending gw ga ada aja kali ya huhu",twitter
"pola tidur gw, rusak parah, tidur jam 4 bangun jam 12 tiap hari 😞",twitter
"gelisah trs dr tdi malem, entah knp tiba2 ngrasa takut ga jelas gt",twitter
"nervous banget sebelum kerja, perut mual deg2an 🤯",twitter
"ga mau ketemu siapapun, gamau, ngomong, mau sendiri aja nangis",twitter
https://t.co/abcxyz @collegemenfess check this out!!!,twitter
"rebahan dr jam 11 tp baru ketiduran subuh, badan ancur bgt",twitter
@collegemenfess kak boleh kirim curhatan ga?,twitter
"tiap malem begadang, bukan krn mau, tp emg gabisa tidur",twitter
"nangis di kamar mandi, biar ga ketauan, sendirian bgt 😞",twitter
"insomnia kumat lg, tiap malem cuma rebahan sambil nangis 💔",twitter
"ngrasa gagal trs, ga pernah cukup apapun yg gw lakuin",twitter
"stress poll deadline numpuk smua minta kmrn malem,, otak gw uda ga jalan 🤯",twitter
"ga tau knp nangis2 sendiri, ngrsa ga berguna bgt hidup gw, slesai",twitter
"takut gagal poll sampe gemeteran sblm, meeting",twitter
"overthinking trs smpe, ga bs tidur, besok ada masalah keluarga tp malah kepikiran yg bukan2",twitter
"overthinking trs smpe ga bs tidur, besok ada ekspektasi org lain tp malah kepikiran yg bukan2",twitter
"tiap mau tidur kepikiran tugas kuliah, anxiety, naik trs 😞",twitter
"tekanan dr segala arah, dari ortu dosen pacar, mau kabur, rasanya 😢",twitter
"jam segini masih melek pdhl besok pagi hrs ujian, capek poll",twitter
"gelisah trs dr kmrn malem, entah knp tiba2 ngrasa takut ga jelas gt 😭😭",twitter
"anxiety gw kumat lg, jantung deg2an, pdhl ga ada apa2 help",twitter
"panik parah tadi kuliah, tangan gemetaran keringetan malu bngt",twitter
"udh minum susu, matiin hp,, tp tetep aja melek sampe subuh",twitter
"tekanan dr segala arah, dari ortu dosen pacar, mau kabur rasanya 😞",twitter
"ga bisa fokus sm sekali, pikiran kemana2 overthinking parah poll sih",twitter
"susah poll tidur belakangan ini, setiap mau tidur tiba2 anxiety 💔",twitter
"ga ada energi buat ngapa2in, makan aja males apalagi keluar huhu",twitter
"gabisa tidur dr kmrn, badan cape amat tp otak ga mau berhenti",twitter
follow @akunjualan dapat cashback,twitter
https://t.co/abcxyz @collegemenfess check this out!!!,twitter
promo!! diskon 50% buruan order skrg,twitter
promo!! diskon 50% buruan order skrg,twitter
"gw gabisa tidur dr beberapa hari ini, pikiran muter2 ga brenti ttg ekspektasi org lain",twitter
"kerja keras trs tp ga ada, apresiasi, cape bgt sm kondisi ini",twitter
"tekanan dr segala arah, dari ortu dosen pacar,, mau kabur rasanya 🤯",twitter
"tiap mau tidur, kepikiran macem2, makanya ga bs tidur 🤯",twitter
takut gagal amat sampe gemeteran sblm kuliah 😭😭,twitter
"tertekan bgt sm ekspektasi ortu, capek ngejar standar org lain mulu 🤯",twitter
"udh 3 hari ini tidur kurang dr, 3 jam, badan ga kuat",twitter
follow @akunjualan dapat cashback,twitter
"insomnia gw makin parah belakangan ini, sampe sakit kepala tiap, pagi",twitter
"tiap mau tidur kepikiran, sidang skripsi, anxiety naik trs",twitter
"ngerasa ga kuat lg, nanggung smua sendirian, terlalu banyak 😭😭",twitter
"ga bisa fokus sm sekali, pikiran kemana2, overthinking parah banget sih",twitter
"nervous parah sebelum interview, perut mual deg2an",twitter
"kelelahan parah tp ga bs tidur, badan lemes otak masih jalan terus 🤯",twitter
"takut banget sama future gw, smua org keliatan sukses cuma gw doang yg stuck 😰",twitter
"udh 3 hari ini tidur kurang dr 3 jam, badan ga kuat 💔",twitter
"burnout parah, udh sebulan kerja keras tp hasilnya nihil kecewa poll 😭😭",twitter
"jam segini masih melek pdhl besok pagi hrs kerja, capek bgt",twitter
"stress level gw udah tinggi, mau healing tp ga ada waktu sama sekali",twitter
"udh ga sanggup lg ngejalanin ini semua, capek poll, sm rutinitas",twitter
https://t.co/abcxyz @collegemenfess check this out!!!,twitter
"udh ga sanggup lg ngejalanin ini semua, capek parah sm rutinitas 😭😭",twitter
"ngrasa hidup gw ga ada artinya, mau ngapain jg sia2 aja :(",twitter
"stress level gw udah tinggi, mau healing, tp ga ada waktu sama sekali",twitter
"was2 bgt nunggu hasil meeting, deg2an sampe ga, napsu makan 😢",twitter
"jam 2 malem masih gabisa, bobo, pikiran muter2 ga ada habisnya 🤯",twitter
"ga bisa fokus sm sekali, pikiran kemana2 overthinking parah bgt sih :(",twitter
"ga bs dapet tidur yg berkualitas, trs, kebangun tengah malem",twitter
"deg2an trs dr tadi, ga tau knp kayak ada firasat ga enak, gt",twitter
"insomnia kumat lg, tiap malem cuma rebahan sambil nangis 😰",twitter
"ga ada semangat buat ngelakuin apapun, hari2 berat parah",twitter
"capek poll sm tuntutan yg ga ada abisnya, gw jg, manusia bkn robot 😢",twitter
"nervous poll mau ketemu org baru, sosial anxiety gw emg parah 🤯",twitter
"khawatir kalo tugas kuliah ga sesuai rencana, parno bgt jadinya",twitter
"insomnia gw makin parah belakangan ini, sampe sakit kepala tiap pagi 💔",twitter
"putus asa poll, udh nyoba banyak hal tp ga ada yg berhasil pengen nyerah",twitter
"ngrasa sendirian banget pdhl dikelilingin banyak org, ngga ada yg ngerti gw",twitter
"ngerasa trapped di situasi yg ga bs gw kontrol, stress poll huhu",twitter
"ngrasa disconnect sama diri sendiri, kayak liat hidup dr luar",twitter
"ngerasa hampa banget, udh lama ga bs seneng sama sekali capek hidup",twitter
badan udh minta istirahat tp pikiran malah makin aktif pas mau tidur,twitter
"frustrasi amat sama kondisi ini, udh usaha tp ga ada perubahan jg 😭😭",twitter
"gabisa tidur dr kmrn malem, badan cape banget tp otak ga mau berhenti",twitter
"muak parah sm sistem, udh kerja keras tp yg dapet reward org lain",twitter
"deg2an trs dr tadi, ga tau knp kayak ada firasat ga, enak gt 😭😭",twitter
"kelelahan bgt tp ga bs tidur, badan lemes, otak masih jalan terus",twitter
"stress level gw udah tinggi, mau healing tp ga ada waktu sama sekali, :(",twitter
"males ngapa2in, bangun tidur aja cape amat, pengen ilang aja :(",twitter
"udh berminggu2 ga bisa ngrasa seneng, ketawa jg rasanya hampa",twitter
"ngerasa exhausted tp ttp ga bs tidur, ini paling nyiksa, sih 😞",twitter
"panik banget tadi presentasi, tangan gemetaran keringetan malu bngt",twitter
"ga ada semangat buat ngelakuin apapun, hari2 berat bgt",twitter
"gelisah trs dr dua hari lalu, entah knp tiba2 ngrasa, takut ga jelas gt",twitter
"gabisa tidur dr tadi siang, badan cape banget tp otak ga mau berhenti",twitter
"stress level gw udah tinggi, mau healing tp, ga ada waktu sama sekali",twitter
"susah parah tidur belakangan ini, setiap mau, tidur tiba2 anxiety 😰",twitter
rt @user: retweet ini buat keberuntungan,twitter
rt @user: retweet ini buat keberuntungan,twitter
"jam segini masih melek pdhl besok pagi hrs meeting, capek amat",twitter
"setiap bangun pagi ngerasa berat, parah, gamau ngapa2in pengen tiduran aja",twitter
"nangis tiba2 tanpa sebab, udh biasa sih buat gw skrg :(",twitter
"jam segini masih melek pdhl besok pagi hrs kuliah, capek bgt",twitter
"nervous poll mau ketemu org baru, sosial anxiety, gw emg parah",twitter
"ngerasa trapped di situasi yg ga bs gw kontrol, stress bgt",twitter
"gabisa tidur dr seminggu lalu, badan cape poll tp otak ga mau berhenti 😴",twitter
"burnout parah, udh sebulan kerja keras tp hasilnya nihil kecewa amat 😞",twitter
"muak bgt sm sistem, udh kerja keras tp yg dapet reward org lain :(",twitter
"tiap mau tidur kepikiran masa depan, anxiety naik trs 🤯",twitter
"pressure dr semua arah, ngerasa mau pecah tp hrs ttp strong 😴",twitter
"gw gabisa tidur dr seminggu lalu, pikiran muter2 ga brenti ttg sidang skripsi 🤯",twitter
"gelisah trs dr seminggu, lalu, entah knp tiba2 ngrasa takut ga jelas gt",twitter
"panik bgt tadi pertemuan penting, tangan gemetaran keringetan malu bngt 💔",twitter
"otak gw overload parah, info kebanyakan,, ga bs fokus",twitter
"beban keputusan besar numpuk, gw mau meledak rasanya 🤯",twitter
"stress poll deadline numpuk smua, minta kmrn, otak gw uda ga jalan",twitter
"ga ada semangat buat ngelakuin apapun, hari2 berat banget 😴",twitter
"khawatir banget sama interview ini, takut org tua kecewa",twitter
"udh ga ngrasa apa2 lg, kosong amat dalem sini, sedih, jg ga bs 😰",twitter
"khawatir bgt sama presentasi ini, takut org tua kecewa",twitter
"rebahan dr jam 11 tp baru ketiduran subuh, badan ancur parah, 🤯",twitter
"tekanan dr segala arah, dari ortu dosen pacar, mau kabur rasanya",twitter
"tertekan amat sm ekspektasi ortu, capek ngejar standar org lain mulu 😰",twitter
"tekanan dr segala arah, dari ortu dosen pacar, mau kabur rasanya :(",twitter
"tertekan banget sm ekspektasi ortu, capek, ngejar standar org lain mulu",twitter
"ngrasa invisible aja pdhl, lg di keramaian, ga ada yg liat gw 😴",twitter
"udh minum susu, matiin hp, tp tetep aja melek sampe subuh 💔",twitter
"ngerasa ga kuat lg, nanggung smua sendirian, terlalu banyak",twitter
"gelisah trs dr kmrn, entah knp tiba2 ngrasa takut ga jelas gt",twitter
"khawatir kalo presentasi ga sesuai rencana, parno bgt jadinya",twitter
"males ngapa2in, bangun tidur aja cape parah,, pengen ilang aja",twitter
"panik bgt tadi sidang, tangan, gemetaran keringetan malu bngt",twitter
capek pura2 baik2 aja pdhal dalem sini hancur parah,twitter
"udh di titik jenuh amat, smua terasa berat ga ada yg ringan 😭😭",twitter
"ngrasa invisible aja pdhl lg di keramaian, ga, ada yg liat gw 😰",twitter
"khawatir kalo skripsi, ga sesuai rencana, parno bgt jadinya",twitter
"gw gabisa tidur dr tdi malem, pikiran muter2 ga brenti ttg keputusan besar",twitter
"otak gw overload amat, info kebanyakan, ga bs fokus :(",twitter
"otak gw overload amat, info kebanyakan, ga bs fokus 😢",twitter
"nervous parah sebelum kuliah, perut mual deg2an 💔",twitter
"badan udh minta istirahat tp pikiran malah makin aktif, pas mau tidur",twitter
"udh minum susu, matiin hp, tp tetep aja melek sampe, subuh",twitter
"ngrasa jd beban buat, semua org, mending gw ga ada aja kali ya",twitter
aq bngung amat mo nangis krn hubungan mulu ttg masa depan 😰,twitter
"overthinking trs smpe ga bs tidur, besok ada masalah keluarga tp malah kepikiran yg bukan2",twitter
"tertekan poll sm ekspektasi ortu, capek ngejar standar org lain mulu 😰",twitter
"takut gagal poll sampe gemeteran, sblm presentasi",twitter
"tekanan dr segala arah, dari ortu dosen pacar, mau kabur rasanya 😰",twitter
"setiap bangun pagi ngerasa berat bgt, gamau ngapa2in pengen tiduran aja",twitter
"udh jam 3 pagi masih melek, besok ada pertemuan penting tp mata ga mau tutup",twitter
"capek poll sm tuntutan yg ga ada, abisnya, gw jg manusia bkn robot",twitter
"capek pura2 baik2 aja, pdhal dalem sini hancur amat huhu",twitter
takut gagal parah sampe gemeteran sblm meeting,twitter
"tekanan dr segala arah, dari ortu dosen pacar, mau kabur, rasanya",twitter
"overwhelmed parah, to-do list makin panjang tp tenaga makin tipis huhu",twitter
"pusing banget, semua hal dateng barengan, gamau mikir apa2 lg 😴",twitter
"mata udh berat bgt tp begitu rebahan langsung, melek lg",twitter
"nervous banget sebelum kuliah, perut mual deg2an",twitter
"muak amat sm sistem, udh kerja keras tp yg dapet reward org lain",twitter
"overthinking trs smpe ga bs tidur, besok ada ekspektasi org lain tp malah kepikiran yg bukan2 💔",twitter
"udh ga sanggup lg ngejalanin ini, semua, capek amat sm rutinitas",twitter
"ga ada energi, buat ngapa2in, makan aja males apalagi keluar",twitter
"gelisah trs dr beberapa hari ini, entah knp tiba2 ngrasa takut ga jelas gt huhu",twitter
"panic attack lagi, napas sesak jantung mau copot tolong 🤯",twitter
"takut bgt sama future gw, smua org keliatan sukses cuma gw, doang yg stuck",twitter
"deadline kmrn malem tp belom mulai, stress gw tingkat dewa udh",twitter
"ga bisa fokus sm sekali, pikiran kemana2 overthinking parah parah sih 😢",twitter
"ngerasa exhausted tp ttp ga bs tidur,, ini paling nyiksa sih 😴",twitter
"anxiety gw kumat lg, jantung deg2an, pdhl ga ada apa2 help",twitter
"khawatir kalo presentasi ga sesuai rencana, parno bgt jadinya :(",twitter
